date,item_id,gist_en,url,decision,notes
2026-07-23,32e27b72ee18127e9dd67b8b,Notice on Holding 2025 Power Digital Intelligence Conference,http://www.chinapower.com.cn/gg/20251014/284210.html,,
2026-07-23,d9373468d5b8550a4e9cac2a,'Better to Have Nine False Alarms Than Miss One Real Threat',http://news.cyol.com/gb/news/articles/2026-07/23/content_77qXzZUeEm.html,,
2026-07-23,898dab67c935a90a1fcf8ad4,Please Note: 'China Discipline Inspection and Supervision' Issue 14 of 2026,https://zgjjjc.ccdi.gov.cn/bqml/index_202614.html,,
2026-07-23,cba010bd7f182ffdd6088fde,Tangshan Port in Hebei Handles Over 445 Million Tons of Cargo in First Half of Year,http://jjckb.xinhuanet.com/20260723/b373b6890d9d474fa15cf53defd8f2f3/c.html,,
2026-07-23,79ba4a95e3fecaefa617ba43,Cover Story: Green Hydrogen 'Cools Down',https://www.inengyuan.com/h2/13169.html,,
2026-07-23,af2d0727a41015f01d872a61,A Glimpse: Why the General Secretary Highly Values Basic Education,https://www.guancha.cn/politics/2026_07_23_824849.shtml,,
2026-07-23,d73745ab4dc0f55794c0b6c5,Four Warnings Issued: Typhoon 'Hongxia' Set to Make Landfall Along Guangdong and Fujian Coasts,https://www.jiemian.com/article/14819570.html,,
2026-07-23,7cc0bc35f26e0b8c10812ae0,Communist Party of China Central Committee and State Council Issue Opinion on Strengthening Social Work in the New Era,http://www.legaldaily.com.cn/index_article/content/2026-07/23/content_9429364.html,,
2026-07-23,2498cc61fc2fc4618e6bcd55,Math's New Peak: China's Fields Medal Moment,https://www.nbd.com.cn/zhuanti2023/mjapp/nbdapp/dist/index.html#/sd100/topicDetails?feature_id=2511,,
2026-07-23,4da75d6779e258fd65f99960,'People's Consumption' Consumer Association Education Classroom,http://finance.people.com.cn/GB/8215/452688/index.html,,
2026-07-23,32dc930e6080802cd36aed19,Xi Jinping: Speech at the Celebration of the 105th Anniversary of the Founding of the Communist Party of China,https://www.qstheory.cn/20260715/04aebc1bf2754c8a8c3c424efd26c53c/c.html,,
2026-07-23,6f2f4cda8a09c9ae5fc20f7e,Xi Jinping Attends Opening of 2026 World Artificial Intelligence Conference and Delivers Keynote Speech,http://www.qizhiwang.org.cn/n1/2026/0717/c422351-40762775.html,,
2026-07-23,4c8d738f336e3c0105b159d9,"Zhang Yu: Navigating by Bearing, Financial Change—Thoughts on Monetary Policy When Old Measures Cannot Gauge New Ships",http://finance.sina.com.cn/zl/china/2026-07-23/zl-iniitzpn4493617.shtml,,
2026-07-23,da5d5f6ca4a70b4bf6e579f7,"Bad News Strikes! Tech Giants Plummet; Fed Rate Hikes, Expectations Accelerate",https://www.stcn.com/article/detail/4038526.html,,
2026-07-23,509eb312ce23ee6d562bfe7b,Deepening Science Education 'Value-Added' Work: Xi Jinping's Important Directive on Basic Education Illuminates the Path Forward,https://www.stdaily.com/web/2026-07/23/content_551973.html,,
2026-07-23,b185a83183d4091f87174d37,U.S. Announces New Tariff Measures Taking Effect on the 24th,https://m.thepaper.cn/detail/33649069,,
2026-07-23,d5f2d0eb82e76362ed7336bc,MIIT Minister: 'Decoupling and Breaking Chains' Benefits No One,https://www.thepaper.cn/newsDetail_forward_33647063,,
2026-07-23,02a5c3410849e396c508d3e4,Continuously Opening Up New Horizons for High-Quality Development of Basic Education,http://www.news.cn/video/20260723/851d6e6a8e0e4e949b191396602fc356/c.html,,
2026-07-23,f8afca705dcb1f6dfb86899c,U.S. Announces New Tariff Measures Taking Effect July 24,https://www.yicai.com/brief/103290127.html,,
